name,ingredients,instructions
Cough,"Honey, Lemon, Warm Water, Ginger, Cinnamon, Turmeric, Apple Cider Vinegar, Clove","Mix 1 tbsp honey, 1 tbsp lemon juice, and a pinch of turmeric in a cup of warm water. Add ½ tsp grated ginger, a dash of cinnamon, 1 tsp apple cider vinegar, and a crushed clove. Stir well and sip slowly. Drink 2-3 times daily to soothe throat irritation, reduce inflammation, and suppress coughing."
Cold,"Ginger, Honey, Lemon, Garlic, Cinnamon, Turmeric, Cayenne Pepper, Peppermint Leaves","Boil 1-inch grated ginger, 2 crushed garlic cloves, and ½ tsp turmeric in 2 cups of water for 10 minutes. Strain, then add 1 tbsp honey, 1 tbsp lemon juice, a pinch of cinnamon, and a dash of cayenne. Stir in fresh peppermint leaves. Drink warm twice daily to relieve congestion, boost immunity, and ease cold symptoms."
Sore Throat,"Salt, Warm Water, Honey, Lemon, Turmeric, Apple Cider Vinegar, Sage, Chamomile","Dissolve ½ tsp salt in 1 cup warm water. Add 1 tsp honey, 1 tbsp lemon juice, ¼ tsp turmeric, and 1 tsp apple cider vinegar. Gargle for 30 seconds, then spit. Repeat 3-4 times daily. For extra relief, sip sage or chamomile tea. This reduces swelling, kills bacteria, and soothes throat pain."
Headache,"Peppermint Oil, Carrier Oil, Lavender Oil, Ginger, Chamomile, Rosemary, Ice Pack, Hydration","Mix 2 drops peppermint oil with 1 tbsp carrier oil (coconut or almond). Massage onto temples and neck. Add 1 drop lavender oil for tension relief. Drink ginger tea, apply a cold compress, or inhale rosemary steam. Stay hydrated. Rest in a dark room. This eases migraines, improves circulation, and relaxes muscles."
Nausea,"Ginger, Water, Peppermint, Lemon, Fennel Seeds, Chamomile, Apple Cider Vinegar, Honey","Boil 1-inch grated ginger in 2 cups water for 5 minutes. Strain and add 1 tsp honey, 1 tbsp lemon juice, and 1 tsp apple cider vinegar. Sip slowly. Chew fennel seeds or drink peppermint/chamomile tea. This calms the stomach, reduces acid reflux, and prevents vomiting."
Indigestion,"Apple Cider Vinegar, Water, Ginger, Peppermint, Fennel, Baking Soda, Lemon, Chamomile","Mix 1 tbsp apple cider vinegar in 1 cup warm water. Add ½ tsp grated ginger, 1 tsp lemon juice, and a pinch of baking soda. Drink before meals. Chew fennel seeds or sip peppermint/chamomile tea. This aids digestion, reduces bloating, and balances stomach acid."
Acid Reflux,"Baking Soda, Water, Aloe Vera Juice, Ginger, Chamomile, Slippery Elm, Almonds, Licorice Root","Mix ½ tsp baking soda in 1 cup water. Sip slowly. Drink ¼ cup aloe vera juice or ginger tea. Chew 3-4 almonds. Try chamomile tea or slippery elm powder. Licorice root (DGL) helps heal the esophagus. Avoid triggers. Use sparingly to neutralize stomach acid without overuse."
Allergies,"Local Honey, Lemon, Turmeric, Quercetin, Nettle Tea, Apple Cider Vinegar, Vitamin C, Omega-3","Take 1 tsp local honey daily. Mix with lemon, turmeric, and 1 tsp apple cider vinegar in warm water. Drink nettle tea or take quercetin supplements. Boost vitamin C (citrus) and omega-3 (flaxseeds). This builds pollen immunity and reduces histamine reactions over time."
Fever,"Lemon, Honey, Warm Water, Ginger, Garlic, Basil, Coconut Water, Hydration","Mix 1 tbsp honey and 1 tbsp lemon juice in warm water. Add ½ tsp grated ginger, 1 crushed garlic clove, and 5 basil leaves. Sip every 2 hours. Drink coconut water for electrolytes. Stay hydrated. This lowers body temperature, fights infection, and restores energy."
Fatigue,"Banana, Honey, Almonds, Chia Seeds, Matcha, Dark Chocolate, Oats, Hydration","Blend 1 banana with 1 tsp honey, 1 tbsp chia seeds, and 1 cup almond milk. Add ½ tsp matcha powder or dark chocolate. Eat oats for slow energy. Stay hydrated. This combats exhaustion with natural sugars, protein, and antioxidants for sustained vitality."
Insomnia,"Chamomile Tea, Lavender Oil, Valerian Root, Magnesium, Warm Milk, Honey, Passionflower, Banana","Steep chamomile tea with 1 tsp honey and warm milk. Add ¼ tsp valerian root or passionflower extract. Inhale lavender oil before bed. Eat a banana (rich in magnesium). This relaxes nerves, regulates sleep cycles, and reduces nighttime awakenings for deeper rest."
Stomachache,"Peppermint Tea, Ginger, Fennel Seeds, Chamomile, Baking Soda, Apple Cider Vinegar, Rice Water, Aloe Vera","Brew peppermint tea with ½ tsp grated ginger and 1 tsp fennel seeds. Sip slowly. For acid relief, mix ½ tsp baking soda in water. Rice water or aloe vera juice soothes inflammation. Chamomile tea calms cramps. This eases gas, bloating, and indigestion within 30 minutes."
Constipation,"Prunes, Water, Flaxseeds, Aloe Vera Juice, Olive Oil, Coffee, Psyllium Husk, Magnesium","Soak 3 prunes overnight; eat with warm water. Mix 1 tbsp flaxseeds in water or take psyllium husk. Drink aloe vera juice or black coffee. Add olive oil to meals. Magnesium supplements help. This stimulates bowel movements and softens stool naturally within 6-12 hours."
Diarrhea,"Banana, Rice, Applesauce, Toast, Probiotic Yogurt, Chamomile Tea, Ginger, Hydration","Follow the BRAT diet (banana, rice, applesauce, toast). Add probiotic yogurt to restore gut flora. Sip ginger or chamomile tea. Stay hydrated with electrolyte solutions. Avoid dairy/fatty foods. This firms stools, reduces cramping, and speeds recovery within 24-48 hours."
Skin Irritation,"Aloe Vera Gel, Coconut Oil, Oatmeal, Honey, Chamomile Tea, Lavender Oil, Cucumber, Baking Soda","Apply fresh aloe gel mixed with 1 tsp coconut oil to irritated skin. Use oatmeal baths or honey masks. Cool with cucumber slices. Lavender oil reduces itching. For rashes, dab baking soda paste. This soothes eczema, allergies, or contact dermatitis within hours."
Sunburn,"Aloe Vera, Coconut Oil, Lavender Oil, Green Tea, Yogurt, Cucumber, Vitamin E, Hydration","Apply chilled aloe gel mixed with 1 tsp coconut oil and 2 drops lavender oil. Cool with green tea compresses or plain yogurt. Hydrate well. Vitamin E oil heals peeling skin. This reduces pain, inflammation, and speeds healing by 50%."
Acne,"Tea Tree Oil, Carrier Oil, Honey, Turmeric, Aloe Vera, Green Tea, Apple Cider Vinegar, Zinc","Dilute 2 drops tea tree oil in 1 tbsp carrier oil. Apply as spot treatment. Use honey-turmeric masks 2x weekly. Rinse with diluted apple cider vinegar. Drink green tea. Zinc supplements reduce breakouts. This kills bacteria, unclogs pores, and fades scars in 4-6 weeks."
Anxiety,"Lavender Oil, Chamomile Tea, Ashwagandha, Magnesium, Valerian Root, Lemon Balm, Dark Chocolate, Omega-3","Inhale lavender oil or drink chamomile tea. Take ashwagandha (300mg) or magnesium daily. Valerian root and lemon balm reduce stress. Eat dark chocolate (70%+) or omega-3s. This lowers cortisol, improves sleep, and stabilizes mood within 2 weeks."
Back Pain,"Epsom Salt, Warm Water, Lavender Oil, Turmeric, Ginger, Arnica Gel, Heat Pad, Magnesium","Soak in warm bath with 2 cups Epsom salt and 5 drops lavender oil. Apply arnica gel to sore areas. Take turmeric-ginger tea. Use a heat pad. Magnesium relaxes muscles. This reduces inflammation and spasms by 40% with regular use."
Bloating,"Fennel Seeds, Warm Water, Peppermint Oil, Ginger, Chamomile Tea, Probiotics, Activated Charcoal, Yoga","Chew 1 tsp fennel seeds after meals. Drink peppermint tea or ginger water. Take probiotics daily. Activated charcoal relieves gas. Try yoga poses (child’s pose, twists). This stimulates digestion and reduces bloating within 30-60 minutes."
Body Odor,"Apple Cider Vinegar, Water, Baking Soda, Coconut Oil, Tea Tree Oil, Lemon, Sage Tea, Chlorophyll","Mix 1 tbsp apple cider vinegar in 1 cup water; apply to underarms. Use baking soda as natural deodorant. Add tea tree oil to coconut oil. Drink sage tea or chlorophyll. This balances pH and kills odor-causing bacteria for 12+ hours."
Bruises,"Arnica Gel, Ice Pack, Pineapple, Vitamin K, Comfrey, Witch Hazel, Turmeric, Compression","Apply arnica gel 3x daily. Ice for 10 minutes hourly. Eat pineapple (bromelain) or vitamin K-rich foods (kale). Witch hazel reduces swelling. Turmeric paste speeds healing. Compression wraps prevent spreading. This fades bruises 50% faster."
Burns (Minor),"Aloe Vera, Honey, Lavender Oil, Coconut Oil, Black Tea, Vitamin E, Yogurt, Hydration","Apply fresh aloe gel mixed with 1 tsp honey and 2 drops lavender oil. Cool with black tea bags. Vitamin E or coconut oil prevents scarring. Yogurt soothes pain. Stay hydrated. This promotes healing in 3-5 days."
Calluses,"Coconut Oil, Pumice Stone, Epsom Salt, Lemon, Baking Soda, Tea Tree Oil, Oatmeal, Shea Butter","Soak feet in warm water with 1 tbsp Epsom salt and 1 tsp baking soda. Exfoliate with pumice stone. Apply coconut oil mixed with 2 drops tea tree oil. Oatmeal paste softens. Shea butter locks in moisture. Repeat nightly for 1 week."
Chapped Lips,"Beeswax, Coconut Oil, Shea Butter, Honey, Aloe Vera, Vitamin E, Cucumber, Green Tea","Melt 1 tbsp beeswax with 2 tbsp coconut oil and 1 tsp honey. Add 1 tsp shea butter and vitamin E oil. Apply as balm. Use cucumber slices or green tea compresses. This heals cracks in 2-3 days."
Chest Congestion,"Eucalyptus Oil, Steam, Ginger, Honey, Lemon, Thyme, Peppermint, Hydration","Boil water; add 3 drops eucalyptus oil and inhale steam for 10 minutes. Drink ginger tea with honey and lemon. Thyme loosens mucus. Peppermint oil on chest. Stay hydrated. This clears lungs within 24 hours."
Chickenpox Itching,"Oatmeal, Baking Soda, Aloe Vera, Chamomile Tea, Coconut Oil, Honey, Lavender Oil, Neem","Add 1 cup oatmeal and ½ cup baking soda to lukewarm bath. Apply aloe vera or coconut oil with 2 drops lavender oil. Chamomile tea compresses reduce inflammation. Neem paste fights infection. This relieves itching for 4-6 hours."
Cold Sores,"Ice, Lemon Balm, Tea Tree Oil, Coconut Oil, Licorice Root, Aloe Vera, Lysine, Zinc","Apply ice for 10 minutes. Dab lemon balm or tea tree oil (diluted) 3x daily. Licorice root paste speeds healing. Take lysine (1000mg) and zinc. Aloe vera reduces pain. This shortens outbreaks by 3 days."
Cracked Heels,"Shea Butter, Vinegar, Coconut Oil, Honey, Epsom Salt, Oatmeal, Lemon, Glycerin","Soak feet in 1 part vinegar, 2 parts warm water for 15 minutes. Scrub with oatmeal paste. Apply shea butter mixed with 1 tsp honey and lemon juice. Cover with socks overnight. Repeat for 3 nights."
Dandruff,"Tea Tree Oil, Coconut Oil, Apple Cider Vinegar, Aloe Vera, Baking Soda, Lemon, Neem, Yogurt","Mix 2 drops tea tree oil with 2 tbsp coconut oil. Massage into scalp; leave for 30 minutes. Rinse with diluted apple cider vinegar. Yogurt or neem paste reduces flakes. Use 2x weekly."
Dehydration,"Electrolyte Drink, Coconut Water, Banana, Cucumber, Aloe Vera, Lemon, Mint, Chia Seeds","Drink coconut water or electrolyte solutions. Eat bananas (potassium). Add cucumber/aloe to water. Lemon and mint boost absorption. Chia seeds hydrate. This restores fluids 2x faster than water alone."
Dry Eyes,"Warm Compress, Castor Oil, Omega-3, Cucumber, Green Tea, Aloe Vera, Hydration, Blinking Exercises","Apply warm compress for 5 minutes 2x daily. Use preservative-free castor oil drops. Take omega-3s. Place cucumber slices or cooled green tea bags on eyes. Blink frequently. Aloe vera gel soothes."
Earache,"Warm Olive Oil, Garlic Oil, Tea Tree Oil, Chamomile, Hydration, Steam, Onion, Rest","Heat 2 tbsp olive oil with 1 crushed garlic clove; strain. Add 1 drop tea tree oil. Apply 2-3 drops to ear. Onion poultice reduces pain. Rest and stay hydrated. Avoid inserting objects."
Eczema,"Oatmeal, Coconut Oil, Honey, Aloe Vera, Chamomile, Tea Tree Oil, Vitamin E, Probiotics","Take oatmeal baths 3x weekly. Apply coconut oil mixed with 1 tsp honey and aloe vera. Chamomile compresses reduce itching. Probiotics balance gut-skin axis. Vitamin E heals cracks. Avoid triggers."
Eye Bags,"Cucumber Slices, Tea Bags, Aloe Vera, Cold Spoon, Potato, Rose Water, Hydration, Sleep","Place chilled cucumber slices or tea bags (caffeinated) for 10 minutes. Use aloe vera gel or rose water. Cold spoon depuffs. Grated potato reduces darkness. Sleep 7-8 hours nightly."
Fever Blisters,"Licorice Root, Ice, Tea Tree Oil, Coconut Oil, Lemon Balm, Aloe Vera, Lysine, Zinc","Apply ice for 5 minutes. Dab licorice root extract or lemon balm ointment 3x daily. Take lysine (1000mg) and zinc. Coconut oil with tea tree oil prevents infection. Aloe vera soothes."
Flatulence,"Peppermint Tea, Ginger, Fennel Seeds, Activated Charcoal, Chamomile, Probiotics, Yoga, Warm Compress","Drink peppermint tea after meals. Chew ginger or fennel seeds. Activated charcoal absorbs gas. Probiotics improve gut health. Yoga poses (wind-relieving pose) help. Warm compress on stomach."
Flu,"Elderberry Syrup, Ginger Tea, Garlic, Honey, Lemon, Echinacea, Hydration, Rest","Take 1 tbsp elderberry syrup 3x daily. Drink ginger tea with honey and lemon. Eat raw garlic. Echinacea boosts immunity. Rest and hydrate well. This shortens flu duration by 2 days."
Foot Fungus,"Tea Tree Oil, Vinegar Soak, Coconut Oil, Garlic, Baking Soda, Oregano Oil, Turmeric, Socks","Soak feet in 1 part vinegar, 1 part water for 15 minutes. Apply tea tree oil (diluted) or coconut oil with crushed garlic. Use baking soda as powder. Wear clean socks. Repeat for 2 weeks."
Gallstones (Prevention),"Apple Juice, Lemon Juice, Olive Oil, Dandelion Tea, Beetroot, Turmeric, Hydration, Fiber","Drink 1 glass apple juice daily for a week, then do a lemon juice-olive oil cleanse. Take dandelion tea. Eat beets and turmeric. Stay hydrated. High-fiber diet prevents recurrence."
Gingivitis,"Salt Water, Clove Oil, Aloe Vera, Tea Tree Oil, Coconut Oil, Turmeric, Green Tea, Probiotics","Gargle with warm salt water 3x daily. Apply diluted clove oil to gums. Use aloe vera gel or coconut oil pulling. Turmeric paste reduces inflammation. Green tea rinses help."
Gout,"Cherry Juice, Baking Soda, Turmeric, Ginger, Apple Cider Vinegar, Hydration, Celery, Magnesium","Drink tart cherry juice daily. Mix ½ tsp baking soda in water. Take turmeric-ginger tea. Apple cider vinegar balances pH. Celery seed extract reduces uric acid. Stay hydrated."
Gum Infection,"Turmeric Paste, Salt Water, Tea Tree Oil, Coconut Oil, Aloe Vera, Clove, Garlic, Probiotics","Rinse with warm salt water 3x daily. Apply turmeric paste or diluted tea tree oil. Coconut oil pulling for 10 minutes. Clove oil numbs pain. Probiotics restore oral flora."
Hair Loss,"Rosemary Oil, Onion Juice, Coconut Oil, Aloe Vera, Biotin, Pumpkin Seeds, Green Tea, Scalp Massage","Massage scalp with rosemary oil or onion juice 2x weekly. Use coconut oil with aloe vera. Eat pumpkin seeds (zinc). Biotin supplements. Green tea rinses reduce DHT."
Hangover,"Coconut Water, Ginger, Lemon, Honey, Activated Charcoal, Bananas, Peppermint, B Vitamins","Drink coconut water with lemon and honey. Take activated charcoal. Eat bananas. Peppermint tea settles stomach. B vitamins restore energy. Hydrate and rest. Avoid caffeine."
Heartburn,"Aloe Vera Juice, Almonds, Ginger, Chamomile, Baking Soda, Licorice Root, Apple Cider Vinegar, Slippery Elm","Drink ¼ cup aloe vera juice. Chew 3-4 almonds. Ginger or chamomile tea helps. Baking soda (sparingly). Licorice root (DGL) heals. Slippery elm coats throat."
Hemorrhoids,"Witch Hazel, Coconut Oil, Aloe Vera, Epsom Salt, Fiber, Hydration, Horse Chestnut, Ice Pack","Apply witch hazel pads or coconut oil 3x daily. Sitz bath with Epsom salt. Aloe vera reduces swelling. High-fiber diet. Horse chestnut cream improves circulation."
Hiccups,"Sugar, Water, Lemon, Vinegar, Peppermint, Deep Breathing, Chamomile, Pressure Points","Swallow 1 tsp sugar. Drink cold water or lemon juice. Hold breath. Peppermint oil under nose. Press on diaphragm. Chamomile tea relaxes spasms."
High Blood Pressure,"Garlic, Hibiscus Tea, Omega-3, Beetroot, Magnesium, Dark Chocolate, Flaxseeds, Celery","Eat 1 raw garlic clove daily. Drink hibiscus tea 2x daily. Beetroot juice lowers BP. Magnesium-rich foods. Dark chocolate (70%+). Flaxseeds for omega-3."
Hives,"Oatmeal Bath, Baking Soda, Aloe Vera, Chamomile, Cold Compress, Turmeric, Quercetin, Hydration","Take cool oatmeal bath. Apply baking soda paste. Aloe vera gel cools. Chamomile compresses. Turmeric reduces histamine. Quercetin supplements help."
Hyperacidity,"Banana, Cold Milk, Almonds, Coconut Water, Basil, Fennel, Aloe Vera, Chamomile","Eat ripe bananas. Sip cold milk slowly. Chew almonds. Coconut water balances pH. Basil tea. Fennel seeds after meals."
Immune Booster,"Turmeric, Ginger, Lemon, Honey, Garlic, Echinacea, Vitamin C, Probiotics","Make tea with turmeric, ginger, lemon, and honey. Eat raw garlic. Echinacea tincture. Vitamin C foods. Probiotics daily."
Insect Bites,"Baking Soda, Lavender Oil, Tea Tree Oil, Aloe Vera, Honey, Ice, Basil, Apple Cider Vinegar","Make paste with baking soda and water. Apply lavender or tea tree oil. Aloe vera cools. Honey reduces swelling. Ice for 10 minutes."
Iron Deficiency,"Spinach, Beetroot, Lemon, Lentils, Pumpkin Seeds, Vitamin C, Blackstrap Molasses, Parsley","Eat iron-rich foods (spinach, lentils) with vitamin C (lemon). Pumpkin seeds. Blackstrap molasses in warm milk. Parsley tea boosts absorption."
Itchy Scalp,"Apple Cider Vinegar, Aloe Vera, Tea Tree Oil, Coconut Oil, Lemon, Baking Soda, Neem, Yogurt","Rinse with diluted apple cider vinegar. Aloe vera gel soothes. Tea tree oil shampoo. Coconut oil massage. Yogurt masks balance pH."
Jet Lag,"Melatonin, Hydration, Sunlight, Magnesium, Chamomile, Ginger, Light Therapy, Exercise","Take 0.5-3mg melatonin at destination bedtime. Stay hydrated. Seek morning sunlight. Magnesium relaxes. Ginger tea settles stomach. Light therapy resets clock."
Joint Pain,"Turmeric Milk, Epsom Salt, Ginger, Omega-3, Cherry Juice, Boswellia, Heat Pad, Exercise","Drink turmeric milk nightly. Epsom salt baths. Ginger tea. Omega-3 supplements. Tart cherry juice. Boswellia reduces inflammation."
Kidney Stones,"Lemon Juice, Olive Oil, Hydration, Dandelion Tea, Celery, Magnesium, Pomegranate, Basil","Mix 2 tbsp lemon juice with 1 tbsp olive oil. Drink dandelion tea. Stay hydrated. Celery seed extract. Magnesium prevents recurrence."
Laryngitis,"Honey, Ginger Tea, Steam, Licorice Root, Apple Cider Vinegar, Hydration, Rest, Marshmallow Root","Drink ginger tea with honey. Inhale steam. Licorice root tea soothes. Gargle apple cider vinegar. Rest voice. Marshmallow root coats throat."
Leg Cramps,"Magnesium Oil, Banana, Hydration, Epsom Salt, Coconut Water, Turmeric, Massage, Calcium","Apply magnesium oil to calves. Eat bananas. Stay hydrated. Epsom salt baths. Coconut water for electrolytes. Massage cramped muscles."
Low Energy,"Matcha Tea, Almonds, Chia Seeds, Dark Chocolate, Ginseng, Hydration, Power Naps, Sunlight","Drink matcha tea. Snack on almonds and dark chocolate. Chia seeds in smoothies. Ginseng boosts stamina. 20-minute power naps help."
Menstrual Cramps,"Ginger Tea, Heating Pad, Magnesium, Chamomile, Cinnamon, Omega-3, Yoga, Hydration","Drink ginger tea 3x daily. Heating pad on abdomen. Magnesium relaxes muscles. Chamomile tea. Cinnamon in warm milk. Child’s pose yoga."
Migraine,"Peppermint Oil, Feverfew Tea, Magnesium, Hydration, Cold Compress, Ginger, Butterbur, Dark Room","Apply peppermint oil to temples. Drink feverfew tea. Magnesium supplements. Ice pack on neck. Ginger reduces nausea. Rest in darkness."
Motion Sickness,"Ginger, Peppermint, Acupressure, Hydration, Crackers, Fresh Air, Fennel, Lemon","Chew ginger candy. Peppermint oil under nose. Acupressure wristbands. Sip water. Eat plain crackers. Focus on horizon. Lemon scent helps."
Mouth Ulcers,"Coconut Oil, Salt Water, Aloe Vera, Honey, Chamomile, Sage, Vitamin B12, Zinc","Rinse with salt water 3x daily. Apply coconut oil or honey. Aloe vera gel soothes. Chamomile tea compresses. B12 and zinc heal faster."
Muscle Pain,"Arnica Cream, Epsom Salt, Turmeric, Cherry Juice, Heat Pad, Omega-3, Hydration, Stretching","Apply arnica cream 3x daily. Epsom salt baths. Turmeric tea. Tart cherry juice. Heating pad. Gentle stretching."
Nail Fungus,"Tea Tree Oil, Vinegar Soak, Coconut Oil, Oregano Oil, Garlic, Baking Soda, Vicks, Sunlight","Soak nails in 1:1 vinegar-water for 15 minutes. Apply tea tree or oregano oil. Garlic paste. Vicks VapoRub at night. Sun exposure helps."
Nasal Congestion,"Steam, Eucalyptus Oil, Neti Pot, Ginger, Hydration, Peppermint, Spicy Food, Elevation","Inhale steam with 3 drops eucalyptus oil 2x daily. Neti pot with saline. Ginger tea. Spicy foods clear sinuses. Sleep elevated."
Night Sweats,"Sage Tea, Cotton Sheets, Hydration, Black Cohosh, Cool Room, Soy, Magnesium, Avoid Triggers","Drink sage tea before bed. Wear breathable cotton. Keep room cool. Black cohosh supplements. Avoid alcohol/spicy foods at night."
Oily Skin,"Witch Hazel, Aloe Vera, Clay Mask, Tea Tree Oil, Jojoba Oil, Green Tea, Hydration, Exfoliation","Use witch hazel toner. Clay masks 2x weekly. Tea tree oil spot treatment. Jojoba oil balances. Green tea reduces sebum."
Poison Ivy,"Baking Soda, Oatmeal, Aloe Vera, Apple Cider Vinegar, Cold Compress, Calamine, Jewelweed, Hydrocortisone","Mix baking soda paste. Oatmeal baths. Aloe vera gel. Apple cider vinegar rinse. Cold compresses. Jewelweed soap neutralizes urushiol."
Psoriasis,"Dead Sea Salt, Coconut Oil, Aloe Vera, Turmeric, Omega-3, Sunlight, Probiotics, Stress Reduction","Soak in Dead Sea salt baths. Apply coconut oil with turmeric. Aloe vera gel. Omega-3 supplements. Moderate sun exposure."
Restless Legs,"Magnesium, Warm Bath, Iron, Yoga, Hydration, Valerian Root, Massage, Avoid Caffeine","Take magnesium before bed. Warm baths. Check iron levels. Leg stretches. Hydrate well. Valerian root tea. Massage calves."
Ringworm,"Apple Cider Vinegar, Coconut Oil, Tea Tree Oil, Garlic, Aloe Vera, Turmeric, Sunlight, Cleanliness","Apply apple cider vinegar or coconut oil with tea tree oil 3x daily. Garlic paste fights fungus. Sunlight exposure. Wash bedding."
Rosacea,"Green Tea, Aloe Vera, Oatmeal, Coconut Oil, Probiotics, Omega-3, Sun Protection, Chamomile","Cooled green tea compresses. Aloe vera gel. Oatmeal masks. Coconut oil moisturizes. Probiotics balance gut. Avoid triggers (spicy food)."
Scars,"Vitamin E Oil, Lemon Juice, Aloe Vera, Coconut Oil, Honey, Rosehip Oil, Massage, Sunscreen","Apply vitamin E oil 2x daily. Lemon juice fades dark scars. Aloe vera heals. Rosehip oil regenerates. Always use SPF."
Sciatica,"Turmeric, Heat Pack, Yoga, Omega-3, Epsom Salt, Acupuncture, Anti-Inflammatory Diet, Massage","Turmeric milk reduces inflammation. Heating pad on lower back. Cat-cow yoga poses. Omega-3 supplements. Epsom salt baths."
Seasonal Depression,"St. John's Wort, Sunlight, Omega-3, Exercise, Vitamin D, Light Therapy, Socializing, Routine","Take St. John’s Wort (consult doctor). Morning sunlight. Omega-3s. Daily walks. Light therapy lamp. Maintain social connections."
Shingles,"Oatmeal, Honey, Capsaicin Cream, Cold Compress, Stress Reduction, Lysine, Vitamin B12, Hydration","Oatmeal baths soothe. Manuka honey on sores. Capsaicin cream for pain. Cold compresses. Lysine supplements. B12 boosts nerves."
Sinusitis,"Neti Pot, Salt Water, Steam, Turmeric, Hydration, Spicy Food, Eucalyptus Oil, Rest","Use neti pot with saline 2x daily. Inhale steam with eucalyptus. Turmeric tea. Spicy foods clear mucus. Rest and hydrate."
Snoring,"Peppermint Oil, Honey, Elevation, Hydration, Thyme Tea, Weight Management, Side Sleeping, Humidifier","Inhale peppermint oil before bed. Honey tea soothes throat. Sleep elevated. Stay hydrated. Thyme tea reduces inflammation. Use humidifier."
Sore Muscles,"Epsom Salt, Lavender Oil, Arnica, Tart Cherry Juice, Heat Pad, Protein, Hydration, Stretching","Epsom salt bath with 10 drops lavender oil. Arnica gel. Tart cherry juice reduces inflammation. Heating pad. Gentle stretches."
Strep Throat,"Sage, Salt Water, Honey, Lemon, Garlic, Hydration, Rest, Marshmallow Root","Gargle sage tea or salt water hourly. Honey-lemon-garlic syrup. Stay hydrated. Rest voice. Marshmallow root tea coats throat."
Stress,"Ashwagandha, Chamomile Tea, Lavender, Magnesium, Exercise, Breathing Techniques, Dark Chocolate, Journaling","Ashwagandha (300mg daily). Chamomile tea. Lavender oil diffuser. Magnesium relaxes. 20-minute walks. 4-7-8 breathing. Journal thoughts."
Stye,"Warm Tea Bag, Castor Oil, Aloe Vera, Turmeric, Hydration, Clean Hands, Avoid Makeup, Chamomile","Place warm black tea bag on eye for 10 minutes 3x daily. Castor oil speeds healing. Turmeric reduces swelling. Keep area clean."
Swimmer's Ear,"White Vinegar, Rubbing Alcohol, Garlic Oil, Warm Compress, Hydration, Prevention Drops, Rest, Avoid Q-Tips","Mix equal parts vinegar and alcohol; apply 2 drops after swimming. Garlic oil fights infection. Warm compress. Keep ear dry."
Tension Headache,"Lavender Oil, Warm Compress, Magnesium, Hydration, Neck Stretches, Peppermint Tea, Dark Room, Acupressure","Inhale lavender oil. Warm towel on neck. Magnesium supplements. Neck rolls. Peppermint tea. Pressure point between thumb/index finger."
Toothache,"Clove Oil, Salt Water, Garlic, Peppermint Tea, Cold Compress, Turmeric, Hydration, Dentist","Dab clove oil on tooth. Salt water rinses. Garlic paste numbs pain. Peppermint tea bags. Cold compress. See dentist ASAP."
UTI,"Cranberry Juice, Water, D-Mannose, Probiotics, Parsley Tea, Baking Soda, Hydration, Vitamin C","Drink unsweetened cranberry juice. Take D-mannose supplements. Parsley tea flushes bacteria. Baking soda in water balances pH. Vitamin C boosts immunity."
Varicose Veins,"Horse Chestnut, Apple Cider Vinegar, Compression Stockings, Exercise, Elevation, Flavonoids, Hydration, Massage","Horse chestnut cream improves circulation. ACV compresses. Wear compression socks. Leg elevations. Walk daily. Flavonoid-rich foods (berries)."
